Titre;Temps Total;Temps Préparation;Temps Cuisson;Nombre de personnes;Difficulté;Coût;Ingrédients;Étapes;Ustensiles;Liens_recette
Dalgona coffee (café fouetté);7 min;7 min;-;2;facile;bon marché;"['5 cuillères à soupe de sucre', '5 cuillères à soupe de café instantané lyophilisé', ""5 cuillères à soupe d' eau très chaude"", '2 tasses de lait']";"[""Fouetter vigoureusement le café soluble avec le sucre et l'eau chaude jusqu'à ce qu'il change de texture, double de volume et prenne une couleur plus claire (utiliser un émulsionneur ou pas mal d'huile de coude)"", 'Verser le lait chaud ou à température ambiante dans deux tasses ou verres transparents en laissant de la place pour le café fouetté par dessus.', 'Verser le café fouetté par dessus dans chaque tasse puis déguster.']";[];https://www.marmiton.org/recettes/recette_dalgona-cafe_392418.aspx
Vin de kumquats;10 min;10 min;-;6;très facile;moyen;"['1 kg de sucre', '1 bâton de vanille ou de cannelle', '1 kg de kumquat coupés en 2', '1 citron coupé en morceaux', ""1 l d' alcool à 45° pour fruits"", '5 l de vin rosé']";"[""Mélanger tous les ingrédients dans un grand bocal que l'on peut fermer hermétiquement."", 'Faire macérer un mois en remuant de temps en temps.', 'Filtrer et boire bien frais !']";['1 Entonnoir', '1 Cuillère en bois'];https://www.marmiton.org/recettes/recette_vin-de-kumquats_50365.aspx
Chocolat au lait crémeux;4 min;2 min;2 min;1;très facile;bon marché;['3 carrés de chocolat noir ou à fondre', '1 crème allégée', '30 cl de lait'];['Faire fondre le chocolat avec un petit peu de lait. Ajouter le lait et la crème tout en mélangeant.'];['1 saladier', '1 casserole'];https://www.marmiton.org/recettes/recette_chocolat-au-lait-cremeux_14136.aspx
Liqueur 44;15 min;15 min;-;1;très facile;moyen;"['1 orange non traitée', '44 morceaux de sucre', '44 grains de café', ""1 l d' eau de vie pour fruits""]";"[""Piquer l'orange, non pelée, avec les 44 grains de café."", ""La laisser macérer dans l'eau de vie avec les 44 morceaux de sucre, pendant 44 jours."", 'Filtrer et mettre en bouteille.']";['1 Entonnoir', '1 fourchette', '1 balance de cuisine'];https://www.marmiton.org/recettes/recette_liqueur-44_13644.aspx
Liqueur de prunes;10 min;10 min;-;6;très facile;bon marché;['sucre candy blanc (gros cristaux)', 'prune', 'eau de vie'];"[""Dans un bocal stérilisé, verser 1/3 d'eau de vie, 1/3 de sucre candy et 1/3 de prunes dénoyautées."", ""Laissez macérer 6 mois à l'abri de la lumière.""]";['1 Entonnoir', '1 balance de cuisine'];https://www.marmiton.org/recettes/recette_liqueur-de-prunes_19486.aspx
Detox Water fraise concombre;5 min;5 min;-;1;très facile;bon marché;"['500 g de fraises', '1 concombre', '1 bouquet de menthe fraîche', ""50 cl d' eau""]";"[""Laver et couper les fraises en morceaux, le concombre en rondelles et ajouter quelques feuilles de menthe dans l'eau. Laisser macérer au moins 20 minutes pour parfumer l'eau, voir quelques heures au frais."", 'Succès assuré.']";['1 couteau'];https://www.marmiton.org/recettes/recette_detox-water-fraise-concombre_344021.aspx
Smoothie rhubarbe nectarine;45 min;15 min;-;4;très facile;bon marché;"['15 g de sucre', ""3 cuillères à soupe de miel d'acacia"", '3 nectarines', '200 g de rhubarbe', '50 cl de lait', '½ citron vert']";"[""Nettoyer et enlever la peau de la rhubarbe. La couper en petits cubes et la mettre dans une casserole, la faire cuire pendant 10min avec un peu d'eau et de sucre."", 'Pendant ce temps, éplucher et couper les pêches en morceaux et presser le demi citron, ajouter du lait (selon la consistance souhaitée). Mixer le tout.', ""Une fois la rhubarbe cuite, attendre qu'elle refroidisse légèrement puis l'ajouter au mélange. Mixer de nouveau."", 'Ajouter le miel, mélanger puis réserver au moins 30 min au frais avant dégustation.']";['1 balance de cuisine', '1 casserole'];https://www.marmiton.org/recettes/recette_smoothie-rhubarbe-nectarine_534128.aspx
Kéfir de fruits;1 j 8 min;8 min;-;1;très facile;bon marché;"['2 figues séchées', '4 cuillères à soupe de sucre', '2 cuillères à soupe de kéfir en graines', '1 demi de jus de citron', ""1 l d' eau (minéral de préférence)""]";"[""Dans une bouteille ou un récipient en verre d'un litre environ, mettez les graines de kéfir, le sucre et le jus de citron. Ajoutez un peu d'eau et diluez le sucre au maximum en tournant la bouteille."", ""Ajoutez les figues sèches et complétez le reste de l'espace avec de l'eau."", ""Mettez une gaze sur la bouteille attachez la avec une ficelle, il faut que l'air passe mais pas les insectes."", ""Ensuite laissez au moins 24 ou 36h (selon l'acidité et l'amertume que vous voulez) (moins l'été) la bouteille à température ambiante (si vous voulez qu'il soit plus acide ou plus amer mettez le 36h sinon 24h). En général quand les figues sont remontés la boissons est prête mais vous pouvez la laisser plus longtemps."", 'Une fois que la boissons a assez reposé filtrez-là et mettez-là dans une bouteille type ""bouteille de limonade"" avec un bouchon solide.', ""Conservez le kéfir de fruits au réfrigérateur une fois qu'il est prêt."", 'Ensuite rincez les graines de kéfir et vous pouvez préparer une nouvelle tournée. (vous pouvez aussi conserver les graines de kéfir dans un pot fermé au réfrigérateur)']";['1 balance de cuisine', '1 Réfrigérateur'];https://www.marmiton.org/recettes/recette_kefir-de-fruits_534260.aspx
Moscow Mule;15 min;15 min;-;2;facile;bon marché;"[""1 bouteille d' eau minérale naturelle gazeuse Intense Quézac®"", '12 cl de vodka', '5 cl de sirop de gingembre', '3 cl de jus de citron vert', 'glaçons ou glace pilée', 'menthe (quelques feuilles)', '2 rondelles de citron vert']";['Remplir les verres ou les gobelets en cuivre aux 2/3 de glaçons ou de glace pilée.', 'Verser ensuite dans chaque verre 6 cl de vodka, 1,5 cl de jus de citron et 2,5 cl de sirop de gingembre. Mélanger à l’aide d’une grande cuillère ou d’un agitateur.', 'Compléter chaque verre en versant l’eau minérale naturelle Intense Quézac®. Mélanger brièvement et décorer avec quelques feuilles de menthe et des rondelles de citron vert.'];[];https://www.marmiton.org/recettes/recette_moscow-mule_533226.aspx
Lait chaud au chocolat et épices de Noël;15 min;10 min;5 min;4;facile;bon marché;['1 Okay sans tube®', '2 bonnes pincées de muscade', '1 l de lait entier', '2 bâtons de cannelle', '3 étoiles de badiane', '100 g de chocolat noir (facultatif)', 'biscuits secs en brisures', 'cacao en poudre'];['Verser le lait dans une casserole et le faire chauffer.', 'Ajouter le chocolat détaillé en morceaux et bien mélanger jusqu’à ce qu’il soit totalement fondu.', 'Ajouter ensuite les épices et laisser infuser pendant 5 minutes.', 'Tapisser le fond d’un chinois ou d’un porte-filtres à café avec des feuilles d’essuie-tout Okay Sans Tube®. Placer ce dernier au-dessus des tasses et verser le mélange afin de filtrer les épices, les dépôts ainsi que la fine peau qui pourrait se former en faisant chauffer le lait.', 'Ajouter par dessus de la chantilly, un peu de cacao en poudre et des brisures de biscuits.'];['1 casseroles', '1 chinois', '1 Okay sans tube®'];https://www.marmiton.org/recettes/recette_lait-chaud-au-chocolat-et-epices-de-noel_532446.aspx
Cocktail vert potion magique spécial Halloween;2 min;2 min;-;2;très facile;bon marché;['50 cl de limonade', '4 ml de sirop de menthe', '10 cl de jus de pomme', '4 bonbon fil rouge pour la décoration', '2 chamallows'];['Verse 4 ml de sirop de menthe dans un grand verre puis ajoute 10 cl de jus de pomme, puis la limonade.', 'Mets les fils rouge en les faisant dépasser du verre et mets les chamallows sur la boisson.'];[];https://www.marmiton.org/recettes/recette_cocktail-special-halloween_531991.aspx
Milkshake Halloween;5 min;5 min;-;1;très facile;bon marché;['1 pointe de colorant alimentaire rouge', '1 verre de lait', 'sirop de fraise'];['Verse le sirop tout en versant le lait bien frais.', 'Remue puis mets le colorant, mais attention ! Pas beaucoup.'];[];https://www.marmiton.org/recettes/recette_sang-frais-d-halloween-milk-shake-special-enfant_531941.aspx
Smoothie aux fruits;5 min;5 min;-;2;très facile;bon marché;"['1 banane', '2 abricots', 'fruits , selon les goûts et les moyens', '1 mangue', '2 kiwis', '1 poignée de framboises (surgelées en hiver) ou de fruits rouges ou de fraises', '1 pêche /brugnon', ""1 rondelle d' ananas"", '3 prunes', '½ l de lait écrémé', 'soja', 'glaçons']";['Dans un mixer, mettre tous les fruits coupés en gros morceaux (pelés et dénoyautes bien sûr). La banane est essentielle pour avoir une bonne consistance.', 'Les fruits surgelés donnent une boisson fraîche instantanée.', 'Ajouter le lait et mixer.', 'Verser dans deux verres.'];['1 blender', '1 Mixeur'];https://www.marmiton.org/recettes/recette_smoothie-aux-fruits_34628.aspx
Le vrai Chocolat chaud maison;15 min;10 min;5 min;8;très facile;bon marché;['2 tablettes de chocolat noir', '3 cuillères de crème fraîche épaisse', '4 cuillères à soupe de sucre', '1 extrait de vanille', '2 l de lait', 'pincée de cannelle'];"['Mettre le lait dans une grande casserole à feu doux et attendre que le lait soit tiède.', 'Entretemps, casser en morceaux vos tablettes de chocolat.', ""Ajouter le lait tiède et remuer doucement jusqu'à ce que le tout soit mélangé et ajouter la crème fraiche. Continuez à remuer avec un fouet pour que la crème fraiche ne fasse aucun grumeaux."", ""Finalement, ajouter le sucre, l'extrait de vanille et la cannelle selon votre goût, en faisant attention que cela ne soit pas trop marqué sinon cela masquera un peu le goût du chocolat.""]";['1 casserole', '1 saladier', '1 Fouet cuisine', '1 Cuillère en bois', '1 balance de cuisine'];https://www.marmiton.org/recettes/recette_le-vrai-chocolat-chaud-maison_164759.aspx
Limoncello (liqueur de citron);15 min;15 min;-;4;très facile;bon marché;"['400 g de sucre', '3 citrons', ""50 cl d' alcool à 90° ou 1 litre deau de vie de fruit"", ""50 cl d' eau""]";"[""Faire macérer les zestes de citrons 10 jours dans 1/2 litre d'alcool ou d'eau de vie."", 'Retirer les zestes au bout de 10 jours.', ""Si vous utilisez l'alcool et non l'eau de vie, diluer les 400 g de sucre dans 1/2 litre d'eau. Ou dans le 1/2 l d'eau de vie restant."", 'Mélanger les 2 liquides.', 'Mettre en bouteille. Se conserve au congélateur. Se sert à la sortie du congélo.']";['1 Cuillère en bois', '1 congélateur', '1 balance de cuisine'];https://www.marmiton.org/recettes/recette_limoncello_12511.aspx
Vin chaud aux épices (Alsace);20 min;15 min;5 min;12;très facile;bon marché;"['1½ l de vin rouge (bordeaux, bourgogne ou pinot noir)', '250 g de sucre roux', ""1 zeste d' orange"", '2 étoiles de badiane (anis étoilé)', '2 clous de girofle', '1 morceau de gingembre émincé', '1 orange', '1 zeste de citron', '2 bâtons de cannelle', '1 pointe de couteau de noix muscade râpée']";"['Mélanger tous les ingrédients directement dans la casserole : vin,', 'sucre', 'cannelle', 'étoiles de badiane', 'clous de girofle', 'gingembre', 'noix de muscade et zestes.', 'Porter à ébullition très doucement et laisser frémir 5 minutes', ""Servir très chaud dans des verres en filtrant à l'aide d'une passoire."", ""Disposer une rondelle d'orange par verre.""]";['1 Entonnoir', '1 casserole', '1 Cuillère en bois', '1 Top 5 des meilleures passoires', '1 Amazon Echo', '1 balance de cuisine'];https://www.marmiton.org/recettes/recette_vin-chaud-aux-epices-alsace_12995.aspx
Bissap (Sénégal);30 min;20 min;10 min;2;très facile;moyen;"['100 g de sucre', '1 pincée de muscade', ""2 cuillères à soupe d' eau de fleur d'oranger"", ""2 tasses de fleur d'hibiscus (bissap)"", ""2½ l d' eau"", '2 sachets de sucre vanillé']";"['Rincer le bissap.', ""Faire bouillir le bissap et l'eau jusqu'à totale coloration de l'eau."", ""Laisser refroidir puis retirer le bissap du jus de cuisson. Ajouter à ce jus les sucres, muscade, eau de fleur d'oranger et mélanger."", 'Mettre au frais pendant 5 heures et servir très frais.']";['1 Cuillère en bois', '1 Frigo'];https://www.marmiton.org/recettes/recette_bissap-senegal_13796.aspx
Irish coffee ( Irlande );5 min;5 min;-;1;moyenne;moyen;['5 cl de whisky (whisky irlandais)', 'sucre (plus pratique, 2 cuillères à café de sirop de canne)', 'café assez fort et bien chaud', 'crème chantilly', 'cacao non sucré pour la déco'];"[""Deux astuces avant de commencer : le whiskey sucré et le café doivent être à la même température, c'est à dire très chauds."", 'L\'autre astuce est un petit instrument très simple à réaliser, il vous suffit de ""sacrifier"" une petite cuillère : pliez une cuillère en ""L"" de façon à former un angle de 90°.', 'Dans un grand verre à pied résistant à la chaleur, versez le whiskey et le sucre de canne bien chaud. Utilisez ensuite votre petite cuillère pliée : il faut la placer dans le verre, à la surface du mélange, versez ensuite le café chaud dans la cuillère, en la remontant au fur et à mesure. Cela permet au café de ne pas ""plonger"" dans le whiskey, donc de rester au dessus et former une deuxième couche.', 'Ajoutez alors la chantilly, qui va former la troisième couche. Eventuellement, saupoudrez de cacao non sucré. Servez avec une paille.']";['1 saladier', '1 petite cuillère', '1 balance de cuisine'];https://www.marmiton.org/recettes/recette_irish-coffee-irlande_12137.aspx
Kéfir de fruit;3 j 15 min;15 min;-;4;très facile;bon marché;"['40 g de kéfir en grains', '40 g de sucre', '1 orange ou autre agrume (citron, clémentine, ...)', ""1 l d' eau""]";['Dans un bocal, verser l’eau, y diluer le sucre puis ajouter les grains de kéfir, les fruits secs, l’agrume (coupé en quartier).', 'Laisser fermenter 24h à 48h (le milieu devient trouble, des bulles sortent régulièrement des grains et les fruits secs remontent en surface).', 'Enlever les fruits secs et les quartiers d’agrume, filtrer la boisson et la transvaser dans des bouteilles avec fermetures hermétiques (type bouteilles de soda).', 'Rincer les grains et relancer une fermentation dans la foulée, ou stocker les grains dans un peu d’eau sucrée au frais dans l’attente d’une utilisation ultérieure.', 'Laisser la fermentation se poursuivre 2-3 jours à température ambiante dans les bouteilles fermées, puis conserver les bouteilles au frigo jusqu’à leur consommation.'];[];https://www.marmiton.org/recettes/recette_kefir-de-fruit_383812.aspx
Kéfir de fruits (type limonade à l'ancienne);10 min;10 min;-;5;très facile;bon marché;['4 figues', '200 g de sucre en poudre', '200 g de kéfir (égouttées)', '1 citron'];"[""Se munir d'un grand récipient (ex: bocal « Le parfait 3l ») et de bouteilles à fermeture mécanique (type limonade à l'ancienne ex : 1l + 75cl + 75cl)"", ""Égoutter les graines de kéfir dans une passoire tamis, les rincer, peser 200g et le verser dans le grand bocal. Ajouter un peu d'eau, 200g de sucre en poudre, 3 figues sèches coupées en deux et le jus d'un citron. Compléter avec de l'eau jusqu'à 2 ou 3 cm du haut du bocal (eau sans chlore de préférence). Refermez votre bocal et bien secouer pour que le sucre ne reste pas au fond."", ""Laissez fermenter environ 12-24h. (Durée a moduler s'il fait froid ou si l'on veut un kéfir plus corsé qu'une limonade)."", ""Retirer les figues qui doivent avoir remonté à la surface et mettre en bouteille à l'aide de la passoire tamis et d'un entonnoir. Laisser 3-4 cm d'air en haut des bouteilles et refermez les."", ""Rincez les graines de kéfir avant de les remettre avec de l'eau et un peu de sucre dans un petit bocal au frigo. (peut se conserver plusieurs mois dans ces conditions si on les sort une fois par mois pour les réactiver : rincer, changer l'eau et mettre un peu de sucre)"", ""Laissez la fermentation se poursuivre en bouteille pendant 4-5 jours à température ambiante. (c'est là que les bulles vont s'affiner)"", ""Puis stocker au frigo et consommer dès que c'est frais."", 'Les bouteilles peuvent se conserver au frigo au moins une semaine mais attention ça continue quand même doucement à fermenter.', 'bonne dégustation']";['1 Top 5 des meilleures passoires', '1 Tamis', '1 Entonnoir', '1 Grands récipient', '1 balance de cuisine'];https://www.marmiton.org/recettes/recette_kefir-de-fruits-type-limonade-a-l-ancienne_92639.aspx
Thé à la menthe marocain;20 min;10 min;10 min;4;facile;bon marché;['25 morceaux de sucre', '2 cuillères à café de thé vert non parfumé', '1 bouquet de menthe fraîche'];"[""Faire chauffer de l'eau, verser 1 petit verre d'eau bouillante sur 2 cuillères à café de thé vert."", ""Après une minute, jeter le liquide, garder le thé. (c'est pour enlever la première amertume du thé), puis verser le reste de l'eau (il faut avoir une petite théière, équipée idéalement d'un filtre dans le bec verseur, c'est + facile)."", ""Ajouter ensuite la menthe fraîche, en noyant tout de suite les feuilles dans l'eau (si elles surnagent, elles prennent un goût de brûlé, un peu amer -avec l'habitude, vous le reconnaîtrez- c'est pour les marocains quand le thé est brûlé)."", 'Par dessus, ajouter les sucres (au moins 25-30 sucres pour 4-5 verres).', 'Pour mélanger.', ""On verse dans les verres en tenant la théière bien haut pour faire 'mousser' le sucre... et on boit très chaud.""]";['1 Cuillère en bois', '1 saladier', '1 balance de cuisine'];https://www.marmiton.org/recettes/recette_the-a-la-menthe-marocain_11146.aspx
Cappuccino;20 min;20 min;-;2;facile;assez cher;['1 tasse de café espresso ristretto', '1 tasse de lait chaud', 'crème chantilly', 'chocolat en poudre'];"[""Versez l'espresso très chaud dans chaque tasse jusqu'à la moitié de la hauteur."", 'Battez le lait chaud pour obtenir une bonne quantité de mousse à la surface.', ""Versez doucement le lait et la mousse dans la tasse d'espresso."", 'Décorez de crème chantilly et parsemez de chocolat en poudre (cacao si vous préférez amer)']";[];https://www.marmiton.org/recettes/recette_cappuccino_19650.aspx
Bubble tea;30 min;15 min;15 min;2;très facile;bon marché;['30 g de perles du Japon', '1 sachet de thé vert ou noir (ou 1 boule de thé en vrac)', '5 cl de sirop au choix (menthe / pêche / grenadine / ...)', '2 gouttes de colorant alimentaire', 'glaçons'];"[""Faire bouillir une casserole d'eau et laisser infuser le thé."", 'Ajouter le sirop puis laisser refroidir le thé.', ""Plonger les perles du Japon dans une casserole d'eau bouillante et ajouter le colorant alimentaire. Laisser cuire 15 minutes minimum, à feu doux, tout en remuant régulièrement. Les perles doivent devenir complètement translucides."", 'Égoutter les perles.', 'Répartir les perles dans le fond de 2 verres, ajouter des glaçons puis remplir le verre avec le thé.', ""Déposer une paille et c'est prêt !""]";['1 casserole'];https://www.marmiton.org/recettes/recette_bubble-tea_345399.aspx
Thé glacé;20 min;20 min;-;1;très facile;bon marché;['2 cuillères à soupe de sucre', '2 sachets de thé', '1 sachet de thé vert', '1 citron', 'menthe'];"[""Faire bouillir 1 litre d'eau et ajouter les sachets de thé. Laisser infuser maximum 15 min."", ""Pendant que l'eau est encore chaude, ajouter le sucre (une grosse cuillère à soupe) la peau du citron coupée en gros copeaux et le citron coupé en 4."", 'Laisser refroidir avant de mettre au frigo (minimum 6 heures).', 'Avant de servir ajouter quelques feuilles de menthe.']";['1 sorbetière', '1 balance de cuisine'];https://www.marmiton.org/recettes/recette_the-glace_37303.aspx
Chocolat viennois;15 min;10 min;5 min;4;facile;bon marché;['1 cuillère à soupe de sucre en poudre', '200 g de crème dessert au chocolat', '1 l de lait', '10 cl de crème liquide'];"['Sur feu très doux, et dans une casserole, faites fondre le chocolat avec 2 cuillères à soupe de lait.', 'Sans cesser de mélanger, incorporez le reste du lait, puis faites chauffer en remuant de temps en temps.', 'Entre temps, dans un saladier bien froid, (passé au congélateur), faites monter la crème en chantilly, puis incorporez le sucre en poudre.', ""Versez le chocolat chaud dans des tasses, puis recouvrez-les d'un dôme de crème chantilly."", ""Petit truc : n'ajoutez la chantilly qu'au dernier moment, sinon elle s'affaissera au contact du chocolat chaud !"", 'Saupoudrez quelques copeaux de chocolat, et dégustez aussitôt...']";['1 casserole', '1 Cuillère en bois', '1 congélateur', '1 saladier', '1 balance de cuisine'];https://www.marmiton.org/recettes/recette_chocolat-viennois_22322.aspx
Smoothie à la banane et au miel;5 min;5 min;-;1;très facile;bon marché;['1 banane bien mûre', '1 cuillère à café de miel', '25 cl de lait demi-écrémé', '½ citron pressé'];"['Tranchez la banane en gros morceaux, puis placez-la dans le mixeur avec le miel, le citron et le lait.', ""Mixez jusqu'à l'obtention d'un liquide épais.""]";['1 blender', '1 Mixeur'];https://www.marmiton.org/recettes/recette_smoothie-a-la-banane-et-au-miel_48199.aspx
VIN de NOIX;30 min;30 min;-;3;très facile;bon marché;"['4 clous de girofle', '1 kg de sucre en poudre (1,2 kg si on préfère + sucré)', '4 l de vin rouge', '40 noix vertes (cueillies vers le 14 Juillet)', ""1 l d' eau de vie de fruits (ou 50 cl d'alcool à 90°C + 50 cl d'eau)""]";"['2 mois macération+1 semaine', ""Couper les noix en 4 , les mettre dans un bocal d'au moins 2 litres ou dans une bonbonne avec les clous de girofle et l'eau de vie."", 'Laisser macérer 2 mois.', 'Ajouter le vin rouge et le sucre et laisser macérer 1 semaine en remuant pour bien dissoudre le sucre.', 'Mettre en bouteilles. Tenir au frais.', 'Attendre 1 an avant de le boire.']";['1 Entonnoir', '1 couteau', '1 balance de cuisine'];https://www.marmiton.org/recettes/recette_vin-de-noix_27195.aspx
Kéfir de lait de ma grand-mère;5 min;5 min;-;50;très facile;bon marché;['30 g de kéfir de lait', '50 cl de lait entier'];"['24 h de repos sont nécessaires.', 'Mettre le lait dans le bocal ou bouteille, ajouter les grains de kéfir de lait (ne pas fermer entièrement le bocal pour que les grains respirent).', 'Garder la préparation à température ambiante et remuer de temps en temps si vous pouvez.', ""Au bout de 24h environ (36 h maximum), le lait doit avoir coagulé et les grains remontés à la surface. Il faut séparer les grains avec une petite passoire en plastique, les passer sous l'eau et remettre le lait au frigo jusqu'à consommation."", 'Les grains seront utilisés immédiatement pour une autre opération.']";['1 Cuillère en bois', '1 Top 5 des meilleures passoires'];https://www.marmiton.org/recettes/recette_kefir-de-lait-de-ma-grand-mere_38673.aspx
Café glacé facile et rapide;5 min;5 min;-;1;très facile;bon marché;['6 cuillères à café de sucre en poudre (plus ou moins si vous le souhaitez)', 'extrait de café (facultatif)', '1 l de lait (déjà froid de préférence)', '6 cuillères de café bombées de café soluble (ou davantage selon votre goût)', 'eau chaude', 'glaçons'];"['Dans un pichet ou une bouteille, mettre le café soluble et le sucre.', ""Verser un petit peu d'eau chaude et remuer pour diluer."", 'Verser le lait et remuer.', 'Si le lait était déjà au réfrigérateur, vous pouvez servir sans attendre, avec beaucoup de glaçons.', 'Sinon, laissez au moins une heure au froid avant de servir.', 'Vous pouvez, si vous le souhaitez, aromatiser le café glacé.', ""Dans ce cas, incorporez l'arôme avec le sucre et le café soluble dès le début."", 'Vous pouvez y mettre deux cuillères à café de vanille liquide, du caramel, un peu de cacao, ou même quelques feuilles de menthe fraîche hachées.', 'Laissez libre cours à vos envies.']";['1 sorbetière', '1 Cuillère en bois', '1 balance de cuisine', '1 Frigo'];https://www.marmiton.org/recettes/recette_cafe-glace-facile-et-rapide_338299.aspx
Apéritif vin d'orange;20 min;20 min;-;3;très facile;moyen;"['500 g de sucre critalisé', '½ gousse de vanille fendue dans la longueur', '4 oranges (amères ou non)non traitées si possible', '2 clous de girofle', 'muscade et cannelle selon les goûts', '2½ l de vin rosé (type Touraine)', ""½ l d' eau de vie de fruits à ~40°"", '1 citron']";"['Laver et couper les fruits en quatre et y planter les clous de girofle. Mélanger dans un grand pot (avec couvercle) le vin, le sucre et la vanille.', ""Bien remuer pour faire dissoudre le sucre et ajouter les fruits et l'alcool, et une pincée ou plus de muscade et cannelle."", 'Laisser massérer pendant 40 jours en remuant une fois par semaine.', 'Filter au moment de la mise en bouteille.', 'Servir bien frais!!!']";['1 Entonnoir', '1 Couvercle', '1 Cuillère en bois', '1 Couteau', '1 balance de cuisine'];https://www.marmiton.org/recettes/recette_aperitif-vin-d-orange_81190.aspx
Café Mocha;20 min;10 min;10 min;2;facile;bon marché;"['30 g de chocolat noir en tablette', ""1 goutte d' extrait de vanille liquide"", '25 cl de lait', ""12 cl de café (ou de déca c'est ce que je fais)"", '1 sachet de sucre vanillé', 'crème chantilly (facultatif)', 'bâton de cannelle (facultatif)', 'cacao en poudre (facultatif)']";"[""Chauffer le lait sur feu doux avec le sucre vanillé et l'extrait de vanille. Ne pas faire bouillir."", ""Dès qu'il est chaud, baisser le feu au minimum et verser sur le lait le café chaud et le chocolat en morceau."", 'Remonter un peu le feu le temps que le chocolat fonde.', 'Fouetter afin de rendre le liquide mousseux.', 'Verser dans des tasses, garnir de crème fouettée et/ou de cacao en poudre.', 'On peut également déposer un bâton de cannelle pour brasser la crème dans le mocha.']";['1 Fouet cuisine', '1 balance de cuisine'];https://www.marmiton.org/recettes/recette_cafe-mocha_232553.aspx
