Titre;Temps Total;Temps Préparation;Temps Cuisson;Nombre de personnes;Difficulté;Coût;Ingrédients;Étapes;Ustensiles;Liens_recette
Thé à la pêche et au citron;10 min;5 min;5 min;4;facile;bon marché;"['50 g de sucre', ""1 l d' eau"", '2 sachets de thé', '4 pêches', '1 citron']";"[""Préparer avec 1 litre d'eau et le thé, une infusion forte et la verser encore chaude dans une carafe."", 'Laver l citron et les pêches, couper le citron en tranches et les pêches en petit tronçons ; les ajouter au thé ; sucrer.', 'Laisser refroidir et conserver au réfrigérateur.', 'Au moment de servir, retirer les tranches de citron.']";['1 couteau', '1 Réfrigérateur'];https://www.marmiton.org/recettes/recette_the-a-la-peche-et-au-citron_311710.aspx
Chocolat chaud au rhum;15 min;5 min;10 min;2;très facile;bon marché;['2 cuillères à soupe de rhum brun ambré', '50 cl de lait', '50 g de crème dessert au chocolat'];"[""Faire chauffer le lait dans une casserole puis incorporer petit à petit les carrés de chocolat en fouettant pour qu'ils fondent et se mélangent bien au lait."", 'Juste avant que le lait ne bouillisse, retirer du feu la casserole puis incorporer les 2 cuillères de rhum.', 'Déguster chaud avec une paille!']";['1 casserole', '1 Fouet cuisine', '1 saladier'];https://www.marmiton.org/recettes/recette_chocolat-chaud-au-rhum_82376.aspx
Smoothie Banane Chocolat;5 min;5 min;-;1;très facile;bon marché;"[""1 banane (ou la moitié d'une grosse)"", '1 demi verre de glaçons', '1 demi verre de lait', '1 cuillère de chocolat en poudre , selon goût']";['Mixer le tout au blender environ 30 sec.'];['1 blender', '1 Mixeur'];https://www.marmiton.org/recettes/recette_smoothie-banane-chocolat_72513.aspx
thé au thym;6 min;5 min;1 min;1;très facile;bon marché;['thym frais', 'thé noir'];"['Pour un thé délicatement parfumé au thym:', ""- si vous n'avez que du thé en sachet, ajoutez un petit branche de thym dans votre tasse."", '- Si vous avez du thé en feuilles, vous pouvez en préparer en quantité en y mélangeant les petites feuilles de thym. Comptez environ 1/3 de thym proportionnellement au thé.']";['1 saladier'];https://www.marmiton.org/recettes/recette_the-au-thym_80244.aspx
Thé Masala;10 min;5 min;5 min;4;très facile;moyen;['1 portion de gingembre sec', '¼ portion de cardamome', '0.1 portion de clou de girofle', '1 portion de poivre en grains', '½ portion de cannelle'];"[""Passez tous ces ingrédients dans un robot jusqu'à ce que cela devient une poudre assez fine."", 'Stocker la poudre obtenue dans un petit bocal en verre fermé.', 'Pour préparer le thé (pour une grande tasse) :', 'Faire bouillir 1/4 litre de lait avec une cuillère à café de thé noir et 1 sucre.', 'A ébullition, ajouter un 1/4 de cuillère à café de poudre massala, laisser bouillir 1 à 2 minutes.', 'Verser dans la tasse en filtrant avec une passoire.', 'Ajuster les quantités de sucre et de massala en fonction de votre goût pour les épices !']";['1 robot pâtissier', '1 casserole', '1 Top 5 des meilleures passoires', '1 balance de cuisine'];https://www.marmiton.org/recettes/recette_the-masala_40642.aspx
Liqueur de coing;10 min;10 min;-;10;très facile;bon marché;"['400 g de sucre', '2 oranges', '1 kg de coing', ""1 l d' alcool pour fruits"", '1 anis étoilé']";"['Cette liqueur doit reposer 1 mois.', 'Pelez et coupez les coings.', 'Gardez les pépins dans une gaze.', ""Ajoutez le tout dans l'alcool de fruit avec les oranges (avec peau) lavées et coupées en rondelles."", ""Ajoutez l'anis étoilé et le sucre."", 'Laissez macérer 1 mois dans un endroit frais en remuant de temps en temps pour que le sucre se mélange bien.', 'Filtrez puis embouteillez.']";['1 Entonnoir', '1 saladier', '1 balance de cuisine'];https://www.marmiton.org/recettes/recette_liqueur-de-coing_53239.aspx
Le chocolat chaud à l'ancienne, de ma mamie!;30 min;20 min;10 min;4;très facile;bon marché;['1 tablette de chocolat au lait', '4 cuillères à café de crème fraîche', '4 tasses de lait entier', 'crème chantilly , si vous voulez'];"['Casser le chocolat en carrés et faire fondre doucement au bain-marie.', 'Quand le chocolat est fondu, ajouter un peu de lait. Mélanger avec un fouet.', ""Ajouter peu à peu le reste du lait en fouettant toujours, jusqu'à obtention d'un mélange homogène."", ""Ajouter la crème. Continuer de fouetter vivement jusqu'à formation d'une mousse sur le dessus."", 'Verser dans 4 tasses.', 'Ajouter un peu de chantilly si vous le désirez.']";['1 casserole', '1 Fouet cuisine', '1 Cuillère en bois', '1 saladier'];https://www.marmiton.org/recettes/recette_le-chocolat-chaud-a-l-ancienne-de-ma-mamie_80223.aspx
Smoothie kiwi banane fraises;10 min;10 min;-;3;très facile;bon marché;['10 fraises', '1 banane', '1 cuillère à soupe de miel (ou de sucre)', '5 kiwis', '5 cl de jus de citron vert en bouteille (ou jus de citron pressé)'];['Pelez les kiwis, et la banane. Coupez les fruits (banane, fraises et kiwis) en rondelles (grossièrement, de toute façon le tout sera mixé).', 'Versez dans un mixer, sans oublier le jus de citron vert et le miel. Et en dernier les kiwis.', 'On mixe et le tour est joué !'];['1 blender', '1 Mixeur'];https://www.marmiton.org/recettes/recette_smoothie-kiwi-banane-fraises_337347.aspx
Cocktail à l’ouzo (Grèce);10 min;10 min;-;1;facile;bon marché;"['1 cuillère à café de sucre de canne', ""3 cl d' ouzo"", ""12 cl de jus d'orange"", 'menthe fraîche', '½ jus de citron', ""1 trait d' eau gazeuse"", ""4 cl de jus d'ananas""]";"['Couper les feuilles de menthe et les répartir dans le fond du verre avec le sucre.', ""Mélanger ensemble le jus d'orange et le jus d'ananas. Verser ce mélange dans le verre et ajouter l'ouzo. Remuer à l’aide d’une cuillère."", 'Puis ajouter les glaçons et arroser d’eau pétillante.']";['1 balance de cuisine'];https://www.marmiton.org/recettes/recette_cocktail-a-l-ouzo-grece_531089.aspx
Smoothie banane-orange;5 min;5 min;-;2;très facile;bon marché;['2 bananes', '2 oranges', '2 cuillères à café de sucre', '3 cuillères à café de jus de citron'];"['Presser les oranges.', ""Mixer ensemble le jus d'orange, le sucre, le jus de citron et les bananes pelées jusqu’à obtenir un mélange homogène."", 'Servir bien frais.']";['1 blender', '1 presse agrume', '1 saladier', '1 Mixeur', '1 balance de cuisine'];https://www.marmiton.org/recettes/recette_smoothie-banane-orange_217261.aspx
Liqueur aux plantes médicinales;1 h;1 h;-;2;moyenne;moyen;"[""2 cuillères à café d' anis vert"", ""500 g de miel d'acacia"", '8 branches de thym', '2 cuillères à café de coriandre', '2 cuillères à café de cumin', '3 cl de sucre de canne', '3 branches de romarin', ""10 g d' étoile de badiane"", '8 branches de serpolet', '8 branches de sarriette', '2 branches de sauge', '4 branches de mélisse', '10 branches de menthe', '50 g de fenouil', '4 girofle', '20 baies de genévrier', '50 brins de génépi', ""5 branches d' estragon"", '1 jus de citron vert', '3 branches de verveine']";"['Émincer les plantes à feuilles. Concasser les graines.', ""Faire macérer pendant 60 jours dans deux litres d'alcool de fruits à 40° dans un récipient de verre fermé hermétiquement."", 'Placer le récipient au soleil la première semaine puis à la cave.', ""Agiter régulièrement pour apporter de l'énergie."", 'Au bout de 60 jours, filtrer le mélange deux fois avec des filtres papier à café.', 'Ajouter enfin le miel et le sucre de canne. Mélanger et laisser reposer.', ""L'ABUS D'ALCOOL EST DANGEREUX POUR LA SANTE. A CONSOMMER AVEC MODÉRATION.""]";['1 Entonnoir', '1 Rouleau à pâtisserie', '1 couteau', '1 saladier', '1 Cuillère en bois', '1 balance de cuisine'];https://www.marmiton.org/recettes/recette_liqueur-aux-plantes-medicinales_232028.aspx
Chocolat au lait by Cyrielle;20 min;10 min;10 min;1;très facile;bon marché;['2 carrés de chocolat pâtissier', '2 sucre', '1 noisette de beurre', '1 cuillère à café de miel', '1 bol de lait', '2 pincées de cannelle'];"['Faites chauffer le lait dans une casserole, à feu doux.', 'Une fois le lait bien chaud, intégrez le chocolat cassé en petits morceaux, et remuez tout le temps.', 'Ajoutez ensuite les sucres, sans cesser de remuer avec une cuillère en bois.', 'Mettez ensuite la noisette de beurre, toujours en remuant; intégrez la cannelle, en remuant toujours.', 'Sortez du feu, versez la préparation dans un bol, puis ajoutez la cuillère à café de miel.', ""Voilà c'est prêt!""]";['1 casserole', '1 Cuillère en bois', '1 bol', '1 balance de cuisine'];https://www.marmiton.org/recettes/recette_chocolat-au-lait-by-cyrielle_48573.aspx
Chocolat chaud aux épices;10 min;5 min;5 min;2;très facile;bon marché;['30 g de chocolat noir', '3 morceaux de sucre', '1 pincée de muscade', '1 pincée de poivre noir', '50 cl de lait entier ou demi écrémé', '5 cl de crème liquide', '1 pincée de cannelle'];"[""Faire chauffer le lait dans une casserole jusqu'à ébullition. Pendant ce temps là casser le chocolat en petits morceaux."", ""Une fois le lait à ébullition, baisser le feu, jeter le chocolat dans la casserole ainsi que les épices et fouetter le mélange jusqu'à ce que le chocolat soit fondu entièrement."", 'Laisser frémir le lait pendant quelques instants. Ajouter la crème liquide, battre de nouveau et... servir!']";['1 casserole', '1 Fouet cuisine', '1 saladier'];https://www.marmiton.org/recettes/recette_chocolat-chaud-aux-epices_29647.aspx
Café pare balles (bulletproof coffee);2 min;2 min;-;1;très facile;bon marché;['1 cuillère à soupe de beurre', '10 cl de café'];['Préparer le café, ajouter le beurre et touiller.'];[];https://www.marmiton.org/recettes/recette_cafe-pare-balles-bulletproof-coffee_342704.aspx
Liqueur de genièvre maison;20 min;20 min;-;1;facile;moyen;"['250 g de sucre fin', ""1 zeste d' orange"", '5 clous de girofle', '1 verre de genièvre', ""1 l d' alcool pour fruits ou eau de vie""]";"[""Récolter en juillet - août suivant l'altitude et la région, (avec une fourchette pour ne pas trop se piquer), des baies de genièvre vertes pratiquement à maturitée, (avant qu'el1es ne noircissent), de façon à en obtenir une fois trillée, au final, 1 verre de 20 à 25 cl."", ""Les baies noircissantes peuvent être gardées pour d'autres plats (choucroute...)"", ""Verser dans un récipient, (de plus d'un litre pouvant être couvert), l'alcool, le sucre, le zeste d'orange, les clous de girofle, remuer et laisser infuser pendant une bonne trentaine de jours en remuant de temps en temps pour bien dissoudre le sucre."", 'Filtrer avec un filtre à café, et laisser vieillir au moins un an.']";['1 Entonnoir', '1 Four', '1 fourchette', '1 Cuillère en bois', '1 Mijoteuse électrique', '1 balance de cuisine'];https://www.marmiton.org/recettes/recette_liqueur-de-genievre-maison_65766.aspx
vin de groseilles;15 min;15 min;-;3;très facile;assez cher;['200 g de sucre en poudre', 'groseilles fraîches (2 kg pour 3 l de vin de groseilles)', '1 l de vin blanc moelleux', '50 cl de cointreau', 'citron (facultatif)'];"['Écrasez les groseilles dans un récipient.', ""Rajoutez y le sucre, mélangez et écrasez jusqu'à ce que le sucre soit totalement dissous."", 'Dans un bocal hermétique (en verre de préférence avec un couvercle en liège) mettez-y la préparation (jus-groseilles-sucre) et versez-y la bouteille de blanc.', 'Fermez et laissez dans un endroit frais et sans lumière. Remuez de temps en temps.', 'Après un mois, filtrez grossièrement et rajoutez 25 cl de Cointreau.', ""Laissez encore 2 semaines au frais et à l'abri de la lumière, toujours en remuant de temps à autre..."", 'Ensuite, filtrez, rajoutez les 25 cl de Cointreau restant, refiltrer si besoin, et mettez en bouteille.']";['1 Entonnoir', '1 saladier', '1 Couvercle', '1 balance de cuisine'];https://www.marmiton.org/recettes/recette_vin-de-groseilles_22994.aspx
Lait d'avoine express;10 min;10 min;-;1;facile;bon marché;"[""1 cuillère à soupe de miel ou sirop d'érable (optionnel)"", ""100 g de flocons d'avoine"", ""1 l d' eau""]";"['Placer les flocons d’avoine dans un blender et ajouter 1 litre d’eau, le sucre et le sel.', 'Mixer longuement sur la puissance maximale (faire des pauses si votre blender n’est pas très puissant).', ""Une fois le mélange bien homogène, filtrer à l’aide d’un tamis fin, en appuyant sur la pulpe d'avoine (appelée okara) à l'aide d'un cuillère à soupe pour extraire le maximum de liquide. L'okara peut être réutilisé dans un gâteau ou des cookies."", 'Verser le lait végétal dans une bouteille, placer au réfrigérateur et consommer dans les 4 jours.']";['1 blender', '1 réfrigérateur', '1 tamis', '1 cuillère à soupe', '1 Balance de cuisine'];https://www.marmiton.org/recettes/recette_lait-d-avoine-express_528522.aspx
Liqueur de bourgeons de sapin;40 min;10 min;30 min;1;facile;moyen;"['300 g de sucre', ""½ l d' eau de vie""]";"['Bien secouer les bourgeons pour éliminer éventuellement de petits insectes. Mettre dans un grand saladier.', ""Verser dessus l'eau-de-vie et laisser macérer 12 heures. Passer le jus."", ""Mouiller le sucre avec un peu d'eau et cuire jusqu'à ce qu'apparaisse la perle au bout d'une spatule en bois. Y incorporer doucement le jus des bourgeons et donner un bouillon."", 'Refroidir et filtrer dans des bouteilles.']";['1 Entonnoir', '1 saladier', '1 Spatule', '1 balance de cuisine'];https://www.marmiton.org/recettes/recette_liqueur-de-bourgeons-de-sapin_30247.aspx
Punch d'Halloween sans alcool;15 min;15 min;-;15;facile;bon marché;"['1 orange', ""1 l de jus d'orange"", ""1 l de jus d'ananas"", '2 pommes', '2 citrons', '70 cl de limonade']";"['Dans un grand saladier, mélanger les jus.', 'Laver les fruits et les détailler en morceaux avant de les mettre sans le récipient.', ""Presser le jus des citrons et l'ajouter au saladier."", 'Réserver au frais pendant 30 minutes.', 'Au moment de servir, allonger avec la limonade.', 'Servir avec des glaçons au sirop de grenadine pour un effet ensanglanté.']";['1 saladier'];https://www.marmiton.org/recettes/recette_punch-d-halloween-sans-alccol_534541.aspx
Chocolat chaud onctueux;1 h;30 min;30 min;6;très facile;bon marché;"['150 g de sucre', '50 g de cacao amer (type Van Houten)', ""zeste d' orange"", '2 l de lait entier']";['Délayer le cacao dans 25 cl de lait froid. Faire chauffer et ajouter le reste du lait. Au bout de 5 mn, incorporer le sucre tout en remuant. Porter à ébullition. Laisser bouillir en surveillant et en remuant pendant 25 mn environ.', 'Après 20 mn de cuisson, incorporer le zeste. Lorsque le liquide devient crémeux et qu’il nappe la cuillère, c’est prêt.', 'La préparation à pratiquement diminué de moitié. Servir pendant que c’est chaud.'];['1 casserole', '1 Fouet cuisine', '1 balance de cuisine'];https://www.marmiton.org/recettes/recette_chocolat-chaud-onctueux_27046.aspx
Liqueur de noyaux d'abricots;10 min;10 min;-;1;très facile;moyen;"['400 g de sucre', '80 abricots', ""50 cl d' alcool à 90°"", ""50 cl d' eau""]";"['Chauffer l’eau et faire fondre le sucre, laisser refroidir.', ""Utiliser un récipient en verre avec couvercle à visser. Versez-y l'alcool et le sirop de sucre. Ajouter les noyaux d'abricots."", ""Laisser macérer à l'abri de la lumière environ 1 mois en secouant la bouteille de temps à autre."", 'Filtrer et mettre en bouteille.']";['1 Entonnoir', '1 casserole', '1 Couvercle', '1 balance de cuisine'];https://www.marmiton.org/recettes/recette_liqueur-de-noyaux-d-abricots_40366.aspx
Smoothie poires & bananes;10 min;10 min;-;2;facile;bon marché;['1 cuillère à café de gingembre pelée et hachée grossièrement', '1 banane', '2 poires mûres, dénoyautées et hachées grossièrement', '25 cl de lait écrémé', '10 glaçons', 'cannelle sur le dessus'];['Mixer les poires et la banane puis ajouter les glaçons, le lait et le gingembre. Mixer à nouveau. Servir saupoudré de cannelle.'];['1 blender', '1 Mixeur'];https://www.marmiton.org/recettes/recette_smoothie-poires-bananes_331223.aspx
Caffe shakerato (café glacé);10 min;10 min;-;4;très facile;bon marché;['40 cl de sucre de canne liquide', '4 café expresso', '10 cl de sirop de vanille', '4 glaçons'];['Préparer 4 cafés expresso. Laissez-les refroidir.', 'Répartir dans chaque verre le sirop de vanille.', 'Verser dans un shaker les 4 cafés, le sucre de canne liquide et les glaçons. Agiter quelques secondes et verser lentement le mélange dans les verres pour former deux niveaux.', 'Servir très frais.'];['1 sorbetière', '1 saladier', '1 shaker', '1 balance de cuisine'];https://www.marmiton.org/recettes/recette_caffe-shakerato-cafe-glace_25402.aspx
Smoothie Light à la Banane et à l'Avoine;5 min;5 min;-;2;très facile;bon marché;"['1 banane', '25 cl de lait de coco', '1 yaourt nature', ""1 verre d' avoine"", ""1 cuillère à café de sirop d'agave (facultatif)""]";"['Couper la banane en petits morceaux.', ""Mettre dans le mixeur, la banane, le yaourt nature, le lait, l'avoine et si vous le voulez le sirop d'agave. Mixer."", 'Verser le tout dans deux mugs et déguster.']";['1 Mixeur'];https://www.marmiton.org/recettes/recette_smoothie-light-a-la-banane-et-a-l-avoine_372330.aspx
Jus de pastèque ultra rafraichissant;5 min;5 min;-;2;très facile;bon marché;['5 glaçons', '¼ pastèque', '1 cuillère à soupe de sirop de grenadine (facultatif)'];['Prendre un morceau de pastèque et le couper en morceaux afin de les mettre dans un blender.', 'Les mixer et les mettre dans un verre.', 'Enfin rajouter quelques glaçons et du sirop pour sucrer la préparation.'];['1 Couteau', '1 Mixeur', '1 blender'];https://www.marmiton.org/recettes/recette_jus-de-pasteque-ultra-rafraichissant_338334.aspx
Café Frappé;2 min;2 min;-;1;très facile;bon marché;['sucre à goût', '4 cuillères à soupe de lait en boîte (genre Gloria)', '1 cuillère de café café instantané', 'eau froide (environs 1/2 verre)', '3 glaçons'];"[""Mettre le tout dans le mixer et mixer jusqu'à ce que les glaçons soient pulverisés."", 'Et voila !', ""On peut aussi ajouter du sucre vanillé, de l'essence d'amandes etc, pour varier les parfums !""]";['1 Mixeur', '1 balance de cuisine'];https://www.marmiton.org/recettes/recette_cafe-frappe_23997.aspx
Green smoothie énergétique;5 min;5 min;-;2;très facile;bon marché;['1 gingembre frais ou 1/2 cuillère à café de gingembre en poudre', '2 kiwis', '½ concombre', '2 pommes', '3 feuilles de salade'];"['Épluchez les fruits et les légumes, retirez le trognon des pommes et les extrémités des kiwis et du concombre, coupez-les en morceaux pas trop gros.', 'Rincez les feuilles de salade.', ""Passez le tout au blender, à l'extracteur ou à la centrifugeuse, selon votre équipement."", 'Consommez immédiatement.']";['1 blender'];https://www.marmiton.org/recettes/recette_green-smoothie-energetique_224200.aspx
Moon milk;7 min;2 min;5 min;1;très facile;bon marché;"['1 pincée de curcuma', '1 cuillère à café de miel liquide', '1 pincée de cardamome', '5 safran pistiles', ""1 tasse de lait d'amande"", '1 pincée de cannelle', '1 pincée de muscade rapée', ""1 pincée d' ashwagandha""]";"[""Faire chauffer le lait d'amande, lorsque le liquide arrive à frémissement ajouter les épices,et laisser bouillir quelques minutes."", 'Servir dans une tasse et ajouter la cuillère de miel. Laisser refroidir 5 min avant de déguster.']";[];https://www.marmiton.org/recettes/recette_moon-milk_392190.aspx
Lait de poule à l'Américaine;10 min;10 min;-;1;très facile;bon marché;"['4 cl de rhum ou de cognac', ""1 jaune d'oeuf"", '1 cl de sirop de sucre de canne', '10 cl de lait frais']";"[""Mixer quelques secondes les ingrédients avec de la glace pilée. Servir dans un 'tumbler'.""]";['1 Mixeur'];https://www.marmiton.org/recettes/recette_lait-de-poule-a-l-americaine_13336.aspx
Chocolat chaud martiniquais à la cannelle et au citron vert;30 min;30 min;-;15;moyenne;moyen;"['2 l de lait demi-écrémé', ""1 gousse de vanille ou 1 cuillère à soupe d'essence de vanille"", '1 boîte de lait concentré sucré', '1 bâton de cannelle ou cannelle en poudre', '1 citron vert (pour le zeste)', '3 cuillères à soupe de cacao en poudre', '1 boîte de lait concentré non sucré', '1 sachet de chocolat en poudre', 'cuillère à soupe de beurre de cacahuètes']";['Faire chauffer le lait 1/2 écrémé avec le lait concentré non sucré, la cannelle, le zeste de citron et la vanille.', 'Ensuite, ajouter le chocolat délayé dans un peu de lait chaud,.', 'Puis laisser consommer 10 minutes sous feu doux en remuant constamment, sans ébullition.', 'Ajouter le lait concentré sucré selon votre goût, puis incorporer le flan délayé dans un peu de lait.', 'L verser en remuant et ajouter le beurre de cacahuète.', 'Laisser 10-15 minutes toujours sous feu doux et remuer avec une cuillère en bois.'];['1 casserole', '1 Cuillère en bois', '1 balance de cuisine'];https://www.marmiton.org/recettes/recette_chocolat-de-premiere-communion-martiniquais_228326.aspx
Limoncello de Sicile;15 min;15 min;-;2;très facile;bon marché;"['400 g de sucre', '1 gousse de vanille', '5 citrons non traités', ""50 cl d' alcool à 90° non modifié"", ""50 cl d' eau""]";"[""Laver les citrons et prélever les zestes puis laisser décanter avec la gousse de vanille dans l'alcool pendant une durée de 10 jours."", 'Il faut utiliser un récipient pas trop grand et couvert.', ""Au bout de cette période, enlever la vanille et les zestes, faire un sirop avec le sucre et l'eau en amenant à ébullition. Une fois le sirop refroidi, le mélanger à l'alcool et remplir vos bouteilles.""]";['1 Cuillère en bois', '1 casserole', '1 balance de cuisine'];https://www.marmiton.org/recettes/recette_limoncello-de-sicile_73419.aspx
Dalgona matcha vegan (au lait de coco);10 min;10 min;-;2;très facile;bon marché;['80 g de sucre de canne', '2 cuillères à café de thé matcha en poudre', '400 ml de lait de coco', '400 ml de lait de coco (ou autre lait végétal)', 'glaçons'];"[""Mélangez la poudre de matcha avec le lait de coco puis montez faire mousser le tout à l'aide d'un batteur électrique."", 'incorporez le sucre puis battez à nouveau, la texture doit être onctueuse.', 'Dans un verre disposez quelques glaçons, le lait puis votre crème de matcha.']";['1 Batteur électrique', '1 balance de cuisine'];https://www.marmiton.org/recettes/recette_dalgona-matcha-vegan-au-lait-de-coco_527819.aspx
Café valdotain ou café de l'amitié;21 min;15 min;6 min;4;très facile;bon marché;"['3 cl de Liqueur (génépi, anisette, rhum, Cognac)', 'sucre', ""1 écorce d'orange"", '40 cl de café', '60 cl de grappa', '1 citron']";"[""Dans une petit casserole versez le café, la grappa, la liqueur le sucre, les écorces d'orange et de citron et portez au point d'ébullition."", 'Saupoudrer les bords de la coupe de sucre et de Grappa.', ""On verse le contenu dans la coupe, on le flambe en remuant jusqu'à ce que le sucre devienne caramélisé."", 'On met le couvercle et on passe la coupe en signe de grande amitié.']";['1 casserole', '1 Couvercle', '1 balance de cuisine'];https://www.marmiton.org/recettes/recette_cafe-valdotain-ou-cafe-de-l-amitie_20423.aspx
Cappuccino véritable;3 min;3 min;-;2;très facile;bon marché;['lait', '1 café fort', 'chocolat en poudre', '1 lait'];"['Préparer un café fort ou selon votre goût.', ""Lorsque le café est presque prêt, verser dans chaque tasse du lait à température ambiante (très important, s'il est trop froid la mousse ne monte pas, de même si c'est du lait chaud!)."", 'Faire mousser avec le mixer à mousse de lait. Attention, le volume doit au moins doubler!', 'Verser dessus très délicatement le café. Il doit rester de la mousse en surface.', 'Rebattre du lait dans un bol à part et rectifier la mousse.', 'Garnir avec une petite cuillère à café de chocolat en poudre.']";['1 Mixeur', '1 bol', '1 Fouet cuisine', '1 petite cuillère'];https://www.marmiton.org/recettes/recette_cappuccino-veritable_41473.aspx
Liqueur de Pruneaux de Mamiette;10 min;10 min;-;1;très facile;assez cher;['30 pruneaux', '30 morceaux de sucre', '1 l de thé bouillant', 'alcool pour fruits'];"[""Mettre les pruneaux dans un grand saladier et les recouvrir d'1 litre de thé bouillant, laissez 1 nuit."", 'Mettre dans un bocal de verre les pruneaux grossièrement égouttés avec le sucre.', ""Recouvrir d'alcool de fruits et attendre 30 jours avant de déguster.""]";['1 Entonnoir', '1 saladier', '1 Couvercle', '1 balance de cuisine'];https://www.marmiton.org/recettes/recette_liqueur-de-pruneaux-de-mamiette_51561.aspx
Smoothie pastèque pomme;10 min;10 min;-;2;très facile;bon marché;"['3 cuillères à soupe de sucre de canne', '1 cuillère à café de vanille liquide', '1 demi de pastèque', '1 pomme', '1 cuillère à café de jus de citron vert', ""2 cuillères à soupe d' eau"", 'feuille de menthe']";"['Éplucher la pomme.', 'Mixer dans un blender la pastèque et la pomme coupées en petits carrés.', 'Ajouter le jus de citron, la vanille, le sucre et mélanger.', ""Ajouter l'eau et la menthe."", 'Servir frais avec des glaçons !']";['1 blender', '1 balance de cuisine'];https://www.marmiton.org/recettes/recette_smoothie-pasteque-pomme_348134.aspx
