Titre;Temps Total;Temps Préparation;Temps Cuisson;Nombre de personnes;Difficulté;Coût;Ingrédients;Étapes;Ustensiles;Liens_recette
Ice Tea // Thé glacé;5 min;5 min;-;1;très facile;bon marché;['1 sachet de thé rouge', 'eau', 'glaçons', '½ citron', '½ citron vert', '6 framboises'];"[""Infuser le sachet de thé dans un fond d'eau chaude."", ""Verser le thé chaud dans un verre rempli de glaçons et compléter d'eau fraiche."", 'Ajouter des framboises fraiches et entières et des rondelles de citron jaune et vert.']";[];https://www.marmiton.org/recettes/recette_ice-tea-the-glace_372752.aspx
Liqueur de lait aux fraises tagada;30 min;30 min;-;2;très facile;bon marché;"['1 l de rhum blanc (même bon marché)', ""1 kg de sucre (moi souvent je n'en mets que 750 g)"", '1 l de lait', '1 citron jaune', '1 citron vert', 'paquet de fraises tagada® ®', ""1 verre de sirop de barbe à papa (parce que j'en avais à la maison et que je ne savais pas quoi en faire !!!)"", ""barbe-à-papa en pot je ne sais où et du coup j'en ai mis un morceau mais bon cela n'a rien apporté à mon avis""]";"[""Tout comme la Liqueur de Carambar dont j'avais déjà donné la recette, la façon de procéder reste la même c'est-à-dire :"", ""Dans un énorme bocal étanche et transparent pour voir au jour le jour ce qu'il se passe à l'intérieur, déposer les citrons coupés en deux."", ""Puis déposer dessus le sucre, les fraises Tagada ®, la barbe à papa, le sirop de barbe à papa (ou tout autre sirop rouge ou rose) et les autres liquide c'est-à-dire le lait et le rhum."", ""Bien fermer le bocal et bien l'agiter..."", 'Mettre dans un endroit sombre et frais...', ""Remuer le bocal tous les jours comme pour la liqueur de Carambar, mais là à ma grande surprise les fraises Tagada ® n'ont jamais fondu (contrairement aux Carambar qui avaient disparu au bout de deux ou trois jours!!!)"", ""Les fraises ont perdu leur couleur et sont devenu blanchâtres et ENORMES comme gorgées du liquide qui, lui, est devenu rose, un très beau rose d'ailleurs !!!"", ""J'ai donc décidé au bout de 15 jours et non pas un mois d'interrompre mon expérience, pensant tout jeter et avoir tout raté !!!"", ""Et bien NON, surprise, j'ai évidemment filtré tout ça, les fraises étaient gluantes et immondes, mais le liquide était très beau et sentait très bon, et nous avons testé avec des amis-cobayes dès le lendemain, et tout le monde en garde un excellent souvenir, donc à faire et à refaire !!!""]";['1 Entonnoir', '1 Cuillère en bois', '1 balance de cuisine'];https://www.marmiton.org/recettes/recette_liqueur-de-lait-aux-fraises-tagada_37097.aspx
Milkshake banana split;5 min;5 min;-;1;facile;bon marché;['1 banane', '15 g de chocolat', '3 boules de glace vanille', '20 cl de lait'];"['Coupez la banane en rondelles, placez celles-ci dans un verre mesureur (ou autre récipient) haut et fin.', ""Versez du lait dans le verre mesureur jusqu'à ce que les rondelles de banane soient recouvertes ( plus ou moins 20 cl)."", 'Ajoutez la glace, mixez une première fois.', 'Ajoutez le chocolat fondu et mixez à nouveau.']";['1 verre mesureur'];https://www.marmiton.org/recettes/recette_milkshake-banana-split_528319.aspx
Smoothie (USA);5 min;5 min;-;4;très facile;bon marché;"['4 bananes', '300 g de fruits surgelés (fraises, cerises, framboises, etc...)', ""½ l de jus de pomme (ou jus d'orange, jus de raisin, suivant le gout)"", 'kiwi ...']";"['Peler les fruits. Les couper en morceaux', ""Mixer le tout. Voilà. C'est prêt."", 'Cet épais jus de fruit est parfait au petit déjeuner ou fait un excellent goûter, peu calorique et plein de vitamines.']";['1 blender', '1 Couteau', '1 Mixeur'];https://www.marmiton.org/recettes/recette_smoothie-usa_14953.aspx
Smoothie ananas passion coco;10 min;10 min;-;1;très facile;moyen;['1 ananas Victoria', '3 fruits de la passion', '50 ml de crème de coco', '½ jus de citron vert'];"['Vider les grains des fruits de la passion dans un blender', 'Ajouter la crème de coco', ""Puis l'ananas coupé en petits morceaux"", 'Et le jus du demi citron vert']";['1 blender'];https://www.marmiton.org/recettes/recette_smoothie-ananas-passion-coco_342871.aspx
Milk-shake yaourt chocolat;5 min;5 min;-;1;très facile;bon marché;['1 cuillère à soupe de yaourt vanille ou nature sucré', '2 cuillères à soupe de glace au chocolat', '1 cuillère à soupe de chocolat en poudre sucré', '10 cl de lait entier ou demi écrémé'];"['Mélanger tous les ingrédients au mixer et le tour est joué.', ""Pour plusieurs personnes, multiplier la quantité par le nombre d'invités."", 'Servir immédiatement.']";['1 Mixeur', '1 Cuillère en bois'];https://www.marmiton.org/recettes/recette_milk-shake-yaourt-chocolat_50994.aspx
Vin d'oranges amères;1h30;1h30;-;10;très facile;bon marché;"['5 oranges douces', '1 bâton de vanille', '2 muscade', '1200 g de sucre en poudre', '8 orange amère', '2 citrons', ""150 cl d' eau de vie"", '10 l de vin blanc (ou de vin rosé)']";"['Ustensiles :', '- une bombone de quinze litres à goulot large', '- dix bouteilles de un litre', '- un verre à moutarde', '- des filtres à café', '- un entonnoir', '- une casserolle', '- deux récipients de 5 litres au moins', 'Préparation :', 'Mettre les dix litres de vin blanc ou de vin rosé (meilleur) dans la bombone.', 'Couper les oranges amères en 8 quartiers et les insérer dans la bombone.', ""Rajouter les dix verres à moutarde d'eau de vie."", 'Rajouter le bâton de vanille, les noix de muscade et les 2 citrons et les 5 oranges coupées aussi en 8 quartiers.', 'Laisser macérer minimum 45 jours, en remuant de temps en temps la bombone.', ""Au bout de 45 jours, transvaser la macération dans les récipients, en la passant par des filtres à café et en prenant bien soin de ne pas faire rendre aux fruits leur jus, afin d'éviter une trop grande amertume de la liqueur."", ""Prélever dans les récipients une casserolle de mouture, puis commencer à faire chauffer à feu doux tout en rajoutant la dose de sucre pour les cinq litres, soit 600 g. Lorsque l'on a obtenu un sirop, on le laisse refroidir puis on le rajoute au récipient en bien remuant."", 'Enfin on transfére la liqueur ainsi obtenu dans des bouteilles en la filtrant à nouveau.']";['1 Entonnoir', '1 couteau', '1 balance de cuisine'];https://www.marmiton.org/recettes/recette_vin-d-oranges-ameres_11970.aspx
Smoothie vite fait bien fait;10 min;10 min;-;3;très facile;bon marché;"['2 bananes', '1 orange', '1 cuillère à soupe de crème fraîche', '3 pommes', '2 kiwis', ""1 cuillère à soupe d' eau""]";"['Pelez les bananes, les pommes et les kiwis.', 'Coupez les bananes en petites rondelles, ainsi que les pommes et les kiwis, mettez-les dans le blender.', ""Ajoutez le jus de l'orange, la cuillère de crème fraîche et une cuillère à soupe d'eau."", 'Mixez le tout dans le blender à puissance maximum.']";['1 blender'];https://www.marmiton.org/recettes/recette_smoothie-vite-fait-bien-fait_86934.aspx
Vin de noix;50 min;50 min;-;6;moyenne;moyen;"['1½ kg de sucre', '1 gousse de vanille', '40 noix vertes (à cueillir vers la fin juin)', ""2 l d' eau de vie""]";"[""Râper les noix, les laisser macérer 4 jours dans l'eau de vie."", 'Ajouter le vin, laisser tremper 3 semaines. Filtrer, ajouter le sucre fondu et mettre en bouteille.']";['1 Entonnoir', '1 Râpe', '1 balance de cuisine'];https://www.marmiton.org/recettes/recette_vin-de-noix_11386.aspx
Smoothie banane praliné;5 min;5 min;-;2;très facile;bon marché;['2 bananes', '1 cuillère à soupe de miel', '1 cuillère à soupe de pralin en poudre', '1 verre de lait (20 cl)'];"['Coupez la banane en morceaux et mettez-les dans votre mixeur ou blender.', 'Ajoutez-y le miel, le pralin et quelques glaçons et recouvrez de lait.', ""Mixez le tout jusqu'à ce que les glaçons aient fondus et que la consistance soit bien mousseuse."", 'Servez illico dans des grands verres avec une pincée de pralin sur le dessus.', 'Dégustez! Mmmmmmmmm !']";['1 blender', '1 Mixeur'];https://www.marmiton.org/recettes/recette_smoothie-banane-praline_61087.aspx
Smoothie djam;10 min;10 min;-;2;très facile;bon marché;['4 oranges', '1 banane', '1 yaourt brassé', '1 pomme'];['Pressez les oranges.', 'Mettre le jus dans 1 mixer. Ajouter les pommes et les bananes coupées en morceaux ainsi que le yaourt.', 'Mixer pendant 1 minute.', 'Boire frais.'];['1 blender', '1 Mixeur'];https://www.marmiton.org/recettes/recette_smoothie-djam_61693.aspx
Thé glacé tout bête;20 min;10 min;10 min;2;très facile;bon marché;"['2 cuillères à soupe de sucre (ou plus selon le goût)', ""2 l d' eau"", '1 citron', '2 sachets de thé vert', '10 feuilles de verveine citronnée ou idem en 2 sachets', '10 feuilles de mélisse', 'citron']";"[""Faire bouillir 1 litre d'eau."", 'Faire infuser le thé, la verveine et la mélisse hors du feu.', 'Laisser infuser au moins 10 minutes.', 'Retirer les sachets et les feuilles.', 'Filtrer.', ""Ajouter le sucre et 1 litre d'eau froide (je fais en gros 2 bouteilles d'un litre donc 50 cl de thé + 50 cl d'eau froide par bouteille!)."", 'Ajouter le jus de citron et bien mélanger.', 'Laisser refroidir puis mettre au frigidaire au moins 3h.', 'Servir très frais.']";['1 sorbetière', '1 Cuillère en bois', '1 balance de cuisine'];https://www.marmiton.org/recettes/recette_the-glace-tout-bete_57885.aspx
Smoothie aux mûres;5 min;5 min;-;3;très facile;bon marché;['1 pot de yaourt de lait', '1 yaourt au citron', '400 g de mûres', '2 glaçons'];"[""Mettre dans un mixer les mûres, le yaourth, le lait et un par un les glaçons. Mixer le tout ( environ 5 minutes pour que ce soit relativement liquide ...) Versez le smoothie dans 3 verres (asser grands) et placez environ, 1h au frigo. Voila, il ne vous reste plus qu'à déguster.""]";['1 blender', '1 Mixeur'];https://www.marmiton.org/recettes/recette_smoothie-aux-mures_93276.aspx
Smoothie fraise-menthe;5 min;5 min;-;2;facile;bon marché;['200 g de fraises', '20 g de sucre', '2 pots de yaourt', '20 cl de lait', 'feuille de menthe'];['Assembler, mixer, servir frais !'];['1 blender', '1 Mixeur'];https://www.marmiton.org/recettes/recette_smoothie-fraise-menthe_212490.aspx
Vin de fenouil;2 j;2 j;-;1;très facile;bon marché;"['125 g de sucre en poudre', '25 g de fenouil séchées de préférence', ""25 cl d' eau de vie de fruit"", '1 bouteille de vin blanc sec']";"[""Laisser macérer 48h les brins de fenouil avec l'alcool dans un bocal de 25 cl fermé."", 'Le fenouil doit être complètement recouvert par l’eau de vie.', 'Verser la moitié du vin blanc dans une bouteille d’un litre.', 'Ajouter l’eau de vie filtrée.', 'Ajouter le sucre.', 'Mélanger, jusqu’à dissolution du sucre en poudre.', 'Compléter avec le reste de vin.', 'Servir frais.', 'A consommer avec modération.']";['1 Entonnoir', '1 Cuillère en bois', '1 balance de cuisine'];https://www.marmiton.org/recettes/recette_vin-de-fenouil_83104.aspx
Vrai chocolat chaud;10 min;5 min;5 min;4;très facile;bon marché;"['200 g de chocolat à 55% de cacao minimum', '100 g de sucre', '75 cl de lait entier', ""25 cl d' eau""]";"[""Portez à ébullition le lait et l'eau."", 'Pendant ce temps, cassez le chocolat en petits morceaux.', 'Quand le lait bout, ôtez du feu et ajoutez le sucre et le chocolat.', 'Après 2 à 3 min, mélangez jusqu’à ce que le chocolat soit entièrement fondu.', 'Portez à nouveau sur feu doux et réchauffez en mélangeant énergiquement avec un fouet.']";['1 casserole', '1 saladier', '1 Fouet cuisine', '1 balance de cuisine'];https://www.marmiton.org/recettes/recette_vrai-chocolat-chaud_72769.aspx
Chocolat chaud épais aux éclats de coco;7 min;2 min;5 min;1;très facile;bon marché;['4 carrés de chocolat noir ou au lait', '1 carré de chocolat blanc aux éclats de coco', 'cuillère à café de sucre', '1 cuillère à café de farine', '25 cl de lait'];"['Dans une casserole, mélangez le lait, le sucre et la farine en évitant les grumeaux.', 'Ajoutez les chocolats coupés en morceaux.', 'Chauffez à feu doux sans arrêter de brasser avec une cuillère en bois.', ""Retirez du feu dès que le mélange s'épaissit (peu avant ébullition)."", 'Laissez refroidir un peu, brassez et servez. Eventuellement, chantilly pour transformer en liégeois mais cache un peu le goût des éclats de coco.', 'Attention ! Si vous mettez trop de farine, à feu trop vif, ou chauffez trop longtemps, vous allez vous retrouver avec une sorte de crème au chocolat, un peu indigeste et pas franchement délicieuse...']";['1 casserole', '1 saladier', '1 balance de cuisine'];https://www.marmiton.org/recettes/recette_chocolat-chaud-epais-aux-eclats-de-coco_71437.aspx
Chocolat frais;5 min;5 min;-;1;très facile;bon marché;['chocolat en poudre', 'lait', 'glace (parfum au choix)', 'crème chantilly', 'sauce chocolat ou caramel'];"['Faire un chocolat au lait et ajouter 1 ou plusieurs parfums de glace (vanille, café, noix de coco, sont mes préférés!).', ""Mélanger, jusqu'à ce que la glace ait fondue. Ajouter de la chantilly et un peu de sauce tiède, au-dessus!"", 'A déguster au gouter!']";['1 Cuillère en bois'];https://www.marmiton.org/recettes/recette_chocolat-frais_39571.aspx
Filtre d'amour au chocolat;11 min;1 min;10 min;1;facile;moyen;"['20 cl de lait demi-écrémé ou entier', '25 g de chocolat noir à pâtisserie', '1 cuillère à soupe de miel', '1 pincée de gingembre', ""1 cuillère d' extrait de vanille (facultatif)"", '1 cuillère à soupe de crème fraîche liquide', '1 pincée de cannelle']";"['Faire fondre à feu doux les carrés de chocolat dans une casserole avec un tout petit peu de lait. Il ne faut surtout pas que le chocolat cuise sinon le filtre est raté.', 'Ajouter le lait petit à petit en fouettant la préparation pour que le lait et le chocolat se lient bien.', 'Monter un peu le feu. Ajouter le reste des ingrédients tout en fouettant la préparation.', 'Goûter et ajuster selon le goût (plus de miel pour plus sucré, plus de cannelle et/ou gingembre pour plus épicé).', ""Fouetter quelques minutes et sortir du feu à la limite de l'ébullition.""]";['1 casserole', '1 Fouet cuisine'];https://www.marmiton.org/recettes/recette_filtre-d-amour-au-chocolat_83204.aspx
Latte di limone (Limoncello);20 min;20 min;-;4;très facile;bon marché;"['800 g de sucre', '1 gousse de vanille', ""6 citrons d'amalfi (de préférence, sinon citrons jaunes non traités)"", ""½ l d' alcool à 90°"", '1 l de lait']";"[""Couper les zestes des citrons en évitant de couper de la chair blanche, et les mettre à tremper dans l'alcool pendant 6 jours."", 'Passés 6 jours, faire bouillir le sucre avec le lait pendant 8 mn. Ajouter la vanille et laisser refroidir.', ""Jeter les zestes des citrons et mélanger l'alcool à la préparation lait – sucre – vanille (tiède)."", 'Verser la crème dans une bouteille qui sera conservé au congélateur.', 'Sortir la bouteille du congélateur 10 mn avant de servir.']";['1 couteau', '1 Cuillère en bois', '1 congélateur', '1 balance de cuisine'];https://www.marmiton.org/recettes/recette_latte-di-limone-limoncello_18693.aspx
Liqueur de coriandre;15 min;15 min;-;20;moyenne;moyen;"['4 clous de girofle', '200 g de sucre', '15 g de graines de coriandre', '5 g de cannelle en bâton', '5 genièvre', ""1 l d' eau de vie"", ""10 cl d' eau""]";"[""Mettre les graines de coriandre, le bâton de cannelle, les clous de girofle et les baies de genièvre dans le bocal à conserves et verser l'eau de vie dessus."", 'Mettre le bocal fermé dans un endroit frais et sombre pendant 5 semaines.', 'Durant ce temps secouer le bocal environ 2 fois par semaine.', ""Après cette période, faire dissoudre sur un feu bas le sucre dans l'eau."", 'Laisser refroidir ce liquide.', ""Tamiser l'eau de vie du bocal."", 'Ajouter le sirop de sucre refroidi.', 'Verser le liqueur dans une ou deux bouteilles et laisser le reposer pendant au moins 3 mois.']";['1 Entonnoir', '1 Tamis', '1 balance de cuisine'];https://www.marmiton.org/recettes/recette_liqueur-de-coriandre_95378.aspx
Liqueur de fleurs d'oranger;15 min;15 min;-;2;moyenne;moyen;"[""1 verre de vin de fleurs d'oranger"", '500 g de sucre', '25 cl de lait', ""1 l d' eau de vie""]";"[""Faire macérer les fleurs d'oranger 2 h dans le lait bouillant."", 'Ajouter le sucre.', 'Laisser macérer 2 jours en remuant matin et soir.', ""Ajouter l'eau de vie."", 'Laisser macérer 8 jours', 'Filtrer, mettre en bouteilles.']";['1 Entonnoir', '1 balance de cuisine'];https://www.marmiton.org/recettes/recette_liqueur-de-fleurs-d-oranger_11314.aspx
Margarita au café;10 min;10 min;-;1;facile;bon marché;['sucre en poudre', 'sel', '1 petite tasse de café froid', '3 cl de téquila', '2 cl de jus de citron vert'];['Humidifiez les bords du verre avec quelques glaçons et un peu de jus de citron, puis trempez les bords dans un mélange de sucre en poudre (80% du mélange) et de sel (20% du mélange) pour un effet givré.', 'Dans un shaker, versez le café, la tequila et le jus de citron.', 'Shakez, filtrez la préparation et versez la boisson dans le verre à cocktail.'];['1 balance de cuisine', '1 shaker'];https://www.marmiton.org/recettes/recette_margarita-au-cafe_534156.aspx
Milkshake au Cooking Chef;5 min;5 min;-;4;facile;bon marché;['20 cl de crème fraîche', '2 cuillères à café de sucre', '200 g de yaourt à la grecque', '20 cl de sirop au parfum de votre choix'];['Congelez le yaourt mélangé au sirop, en petites portions dans des bacs à glaçons, pendant au moins 5 heures.', 'Versez les glaçons obtenus, la crème, le sucre dans la cuve du Cooking Chef. Mixez en augmentant la puissance progressivement avec le blender sur la sortie ultra rapide / 40 sec / 0 °C / vit. 3 à 8. Dégustez immédiatement.'];['1 Cooking Chef', '1 blender', '1 balance de cuisine'];https://www.marmiton.org/recettes/recette_milkshake-au-cooking-chef_383736.aspx
Rainbow smoothie;40 min;40 min;-;2;facile;bon marché;"['2 bananes congelées', '1 banane congelée', '2½ cuillères à soupe de yaourt grec', '40 g de fraises congelées', '120 g de framboises congelées', '1 banane congelée', '2½ cuillères à soupe de yaourt grec', '1 orange', '2 cuillères à soupe de gelée de pêches', '1 cuillère à soupe de gelée de mangue', '2 bananes congelées', '2½ cuillères à soupe de yaourt grec', ""40 g d' ananas congelé"", '½ tasse de yaourt grec, de vanille ou de plaine', '1 poignée de mâche (ou épinard)', ""80 g d' ananas congelé"", '1 banane congelée', '2½ cuillères à soupe de yaourt grec', '120 g de cassis surgelés', '1 banane congelée', '2½ cuillères à soupe de yaourt grec', '2 tranches de betterave', '100 g de framboises fraîches ou surgelées']";"['Pour chaque smoothie :', ""Placer tous les ingrédients dans un blender et mélanger jusqu'à l'obtention d'une consistance lisse. Ajouter de l'eau (ou du lait) si le mélange est trop épais."", 'Transférer le smoothie dans un bol ou un récipient, rincer le blender et préparer la prochaine couche.', 'Réalisation du rainbow smoothie :', 'Verser délicatement les couches les unes après les autres.', 'Décorer les verres avec une brochette de fruits restants.']";['1 blender', '1 saladier', '1 Cuillère en bois', '1 bol'];https://www.marmiton.org/recettes/recette_rainbow-smoothie_345352.aspx
"Smoothie ""good morning"" aux fruits rouges et feuilles vertes";5 min;5 min;-;2;très facile;bon marché;"['gingembre frais selon votre goût', ""25 cl de jus d'orange"", '1 pomme', '100 g de fruits rouges surgelés', '50 g de salade /roquette/épinards en mélange']";['Peler et découper la pomme en dés, râper le gingembre.', 'Mixer ensemble tous les ingrédients, servir frais !'];['1 blender', '1 Râpe', '1 couteau', '1 Mixeur', '1 planche à découper'];https://www.marmiton.org/recettes/recette_smoothie-good-morning-aux-fruits-rouges-et-feuilles-vertes_314182.aspx
Smoothie à la fraise;5 min;5 min;-;2;facile;bon marché;"['250 g de fraises (généralement 1 barquette)', '1 banane', '2 yaourts natures', ""1 jus d'orange"", '4 glaçons']";"['Couper les fraises en deux après les avoir équeutées.', 'Ajouter la banane coupée en rondelles puis les yaourts.', ""Verser les glaçons et le jus d'orange (plus ou moins selon l’onctuosité que l'on veut obtenir)."", ""Pour ma part j'en mets un grand verre dans un premier temps puis j'en ajoute pour obtenir un smoothie crémeux que l'on peut boire à la paille gros diamètre).""]";['1 blender', '1 Couteau'];https://www.marmiton.org/recettes/recette_smoothie-a-la-fraise_309780.aspx
Smoothie rapide aux fruits exotiques;10 min;10 min;-;8;très facile;bon marché;['rhum blanc pour les plus grands (5 cl)!', '450 g de fruits exotiques au sirop sans sucre ajouté', '20 cl de lait de coco'];"[""Verser la boîte de fruits dans un blender et mixer jusqu'à obtenir une purée homogène. Ajouter le lait de coco et mixer à nouveau."", 'Mettre au frais durant au moins 2 heures.', 'Servir très frais dans des grands verres.', 'Pour les plus grands, ajouter un peu de rhum.']";['1 blender', '1 Mixeur', '1 Frigo'];https://www.marmiton.org/recettes/recette_smoothie-rapide-aux-fruits-exotiques_88197.aspx
Summer smoothie;5 min;5 min;-;3;facile;bon marché;['2 bananes', '5 oranges', '2 pommes', '6 glaçons'];"['Couper les bananes en rondelles.', 'Couper les pommes en petits morceaux.', 'Mettre les fruits coupés dans le mixeur.', 'Ajouter les glaçons.', 'Presser les oranges et les ajouter au reste.', ""Mixer jusqu'à ce que les fruits soient bien mélangés.""]";['1 blender', '1 couteau', '1 Mixeur', '1 presse agrume', '1 saladier'];https://www.marmiton.org/recettes/recette_summer-smoothie_334297.aspx
Thé au cumin à la lituanienne;7 min;5 min;2 min;1;très facile;bon marché;['1 pincée de cumin', '15 cl de jus de pomme'];"[""Tapissez le fond d'une tasse de cumin."", ""Remplissez la tasse aux 2/3 avec de l'eau bouillante."", 'Complétez avec le jus de pomme.', 'Servez quand le cumin est redescendu au fond de la tasse.']";[];https://www.marmiton.org/recettes/recette_the-au-cumin-a-la-lituanienne_55013.aspx
Vin d'orange;10 min;10 min;-;1;très facile;moyen;['1 bouteille de vin rouge corsé (type vin du Sud-ouest)', '2 oranges non traitées', '250 g de sucre en poudre'];['Retirez les zestes des oranges et hachez-les au robot', 'Disposez les zestes, le vin et le sucre dans un gros bocal (type Le Parfait), puis mélangez.', 'Laissez mariner pendant 15 jours.', 'Filtrez et mettez en bouteille.'];['1 Entonnoir', '1 robot pâtissier', '1 saladier', '1 balance de cuisine'];https://www.marmiton.org/recettes/recette_vin-d-orange_30955.aspx
Vin de noix de Grenoble;15 min;15 min;-;5;très facile;moyen;"['5 l de vin rouge à 13 ou 14°', '40 morceaux de sucre', '40 noix vertes (cueillies à la St Jean)', ""1 l d' eau de vie"", 'vanille ...', 'cannelle']";['Mélanger tous les ingrédients dans un récipient. Couvrir et laisser reposer 40 jours.', 'Filtrer. Embouteiller. Laisser bonifier 5 ou 6 mois.'];['1 Entonnoir', '1 Couvercle', '1 Cuillère en bois'];https://www.marmiton.org/recettes/recette_vin-de-noix-de-grenoble_14425.aspx
Vin de pissenlit maison;10 min;10 min;-;10;moyenne;moyen;"['1 morceau de gingembre', ""2 zestes d' orange"", '3 kg de sucre', '2 cuillères à café de levure de vin', ""10 l d' eau"", '2½ kg de Fleurs de pissenlit', '2 zestes de citron', '2 citrons (jus)']";"[""Faire bouillir 10 l d'eau, refroidir"", 'et mélanger à 2,5 kg de fleurs de', 'pissenlit bien propres, sans leur', 'calice. Laisser macérer 1 jour.', 'Ajouter 1 gros morceau de gingembre', ""frais, deux zestes d'oranges et deux"", 'zestes de citrons.', 'Faire bouillir 30 min. Filtrer,', 'ajouter 2,8 kg de sucre et 2 jus de', 'citrons. Ajouter 2 cc de levure de', 'vin (dans les magasins de produits', 'vinicoles). Couvrir et laisser', 'fermenter durant 3-4 jours au frais.', 'Transvaser dans un petit fût,', 'boucher hermétiquement et laisser', 'reposer 2 mois.', 'Mettre en bouteille et laisser reposer', '6 mois.']";['1 Entonnoir', '1 Cuillère en bois', '1 Couvercle', '1 balance de cuisine'];https://www.marmiton.org/recettes/recette_vin-de-pissenlit-maison_11092.aspx
Vin chaud aux épices au Monsieur Cuisine;11 min;11 min;-;4;très facile;bon marché;"['50 cl de vin rouge (bordeaux, bourgogne ou pinot noir)', 'sucre roux', '1 étoile de badiane', '1 clou de girofle', '5 g de gingembre frais', '1 pointe de couteau de muscade râpée', '1 orange', '1 cuillère à café de zeste de citron', ""1 cuillère à café de zeste d'orange"", '1 bâton de cannelle']";['Versez dans la cuve de votre Monsieur Cuisine le vin, le sucre, la cannelle, la badiane, le clou de girofle, le gingembre pelé entier, la noix muscade et les zestes. Lancez la cuisson pendant 11 min / vit. 1 / 105 °C.', 'Filtrez, puis servez accompagné de rondelles d’orange.'];['1 Monsieur Cuisine', '1 balance de cuisine'];https://www.marmiton.org/recettes/recette_vin-chaud-aux-epices-au-monsieur-cuisine_382901.aspx
Vin de noix vanillé;15 min;15 min;-;4;très facile;bon marché;"['3½ l de vin rouge', '1 kg de sucre en poudre', '1 gousse de vanille bourbon', ""½ l d' eau de vie"", '12 noix vertes fraiches']";"[""Rincer les noix vertes et les couper en 4 (j'utilise un gros couteau de cuisine et un marteau)."", ""Dans une bonbonne (ou un jerrycan propre) verser le vin, l'eau de vie, le sucre puis ajouter les noix coupées et la gousse de vanille fendue dans le sens de la longueur."", 'Laisser macérer le tout pendant minimum 40 jours en remuant la bonbonne de temps en temps.', 'Filtrer puis mettre en bouteille.', ""Il est préférable d'attendre minimum 6 mois avant de consommer.""]";['1 Entonnoir', '1 Couteau', '1 balance de cuisine'];https://www.marmiton.org/recettes/recette_vin-de-noix-vanille_216939.aspx
